{
  "$schema": "./region.schema.json",
  "region": "wilderness",
  "locations": [
    {
      "name": "Wilderness Crater",
      "url": "https://runescape.wiki/w/Wilderness_Crater"
    },
    {
      "name": "Daemonheim",
      "url": "https://runescape.wiki/w/Daemonheim"
    },
    {
      "name": "Mage Training Arena",
      "url": "https://runescape.wiki/w/Mage_Training_Arena"
    }
  ],
  "bosses": [
    {
      "name": "King Black Dragon",
      "url": "https://runescape.wiki/w/King_Black_Dragon",
      "children": []
    },
    {
      "name": "Flesh-hatcher Mhekarnahz",
      "url": "https://runescape.wiki/w/Flesh-hatcher_Mhekarnahz",
      "children": []
    },
    {
      "name": "Chaos Elemental",
      "url": "https://runescape.wiki/w/Chaos_Elemental",
      "children": []
    },
    {
      "name": "Corporeal Beast",
      "url": "https://runescape.wiki/w/Corporeal_Beast",
      "children": []
    },
    {
      "name": "Elite Dungeon 2 — Dragonkin Laboratory",
      "url": "https://runescape.wiki/w/Dragonkin_Laboratory",
      "children": [
        {
          "name": "Astellarn",
          "url": "https://runescape.wiki/w/Astellarn"
        },
        {
          "name": "Verak Lith",
          "url": "https://runescape.wiki/w/Verak_Lith"
        },
        {
          "name": "Black Stone Dragon",
          "url": "https://runescape.wiki/w/Black_Stone_Dragon"
        }
      ]
    },
    {
      "name": "Elite Dungeon 3 — The Shadow Reef",
      "url": "https://runescape.wiki/w/The_Shadow_Reef",
      "children": [
        {
          "name": "Crassian Leviathan",
          "url": "https://runescape.wiki/w/Crassian_Leviathan"
        },
        {
          "name": "Taraket the Necromancer",
          "url": "https://runescape.wiki/w/Taraket_the_Necromancer"
        },
        {
          "name": "The Ambassador",
          "url": "https://runescape.wiki/w/The_Ambassador"
        }
      ]
    }
  ],
  "features": [
    {
      "name": "Wilderness Slayer",
      "url": "https://runescape.wiki/w/Mandrith"
    },
    {
      "name": "Dungeoneering",
      "url": "https://runescape.wiki/w/Dungeoneering"
    },
    {
      "name": "Primal Mining",
      "url": "https://runescape.wiki/w/Ores#Primal_ores"
    },
    {
      "name": "Wilderness Agility Course",
      "url": "https://runescape.wiki/w/Wilderness_Agility_Course"
    },
    {
      "name": "Daemonheim Dig Site",
      "url": "https://runescape.wiki/w/Daemonheim_Dig_Site"
    },
    {
      "name": "Revenants",
      "url": "https://runescape.wiki/w/Revenants"
    }
  ],
  "pvmUpgrades": [
    {
      "source": "Corporeal Beast",
      "rows": [
        {
          "tier": "75",
          "style": "Necromancy",
          "items": [
            {
              "name": "Spectral Spirit Shield",
              "url": "https://runescape.wiki/w/Spectral_spirit_shield"
            }
          ],
          "note": "",
          "alsoAvailableIn": []
        },
        {
          "tier": "75",
          "style": "Magic",
          "items": [
            {
              "name": "Arcane Spirit Shield",
              "url": "https://runescape.wiki/w/Arcane_spirit_shield"
            }
          ],
          "note": "",
          "alsoAvailableIn": []
        },
        {
          "tier": "75",
          "style": "Ranged",
          "items": [
            {
              "name": "Elysian Spirit Shield",
              "url": "https://runescape.wiki/w/Elysian_spirit_shield"
            }
          ],
          "note": "",
          "alsoAvailableIn": []
        },
        {
          "tier": "75",
          "style": "Melee",
          "items": [
            {
              "name": "Divine Spirit Shield",
              "url": "https://runescape.wiki/w/Divine_spirit_shield"
            }
          ],
          "note": "",
          "alsoAvailableIn": []
        }
      ]
    },
    {
      "source": "Daemonheim",
      "rows": [
        {
          "tier": "85–90",
          "style": "Melee",
          "items": [
            {
              "name": "Primal Equipment",
              "url": "https://runescape.wiki/w/Primal_equipment"
            }
          ],
          "note": "",
          "alsoAvailableIn": []
        },
        {
          "tier": "God Book",
          "style": "Hybrid",
          "items": [
            {
              "name": "Chaotic Grimoire",
              "url": "https://runescape.wiki/w/Chaotic_Grimoire"
            }
          ],
          "note": "",
          "alsoAvailableIn": []
        },
        {
          "tier": "Ring",
          "style": "Hybrid",
          "items": [
            {
              "name": "Ring of Vigour",
              "url": "https://runescape.wiki/w/Ring_of_Vigour"
            }
          ],
          "note": "",
          "alsoAvailableIn": []
        },
        {
          "tier": "55",
          "style": "Melee",
          "items": [
            {
              "name": "Gravite Longsword",
              "url": "https://runescape.wiki/w/Gravite_longsword"
            },
            {
              "name": "Off-hand Gravite Longsword",
              "url": "https://runescape.wiki/w/Off-hand_gravite_longsword"
            },
            {
              "name": "Gravite 2h Sword",
              "url": "https://runescape.wiki/w/Gravite_2h_Sword"
            },
            {
              "name": "Gravite Rapier",
              "url": "https://runescape.wiki/w/Gravite_rapier"
            },
            {
              "name": "Off-hand Gravite Rapier",
              "url": "https://runescape.wiki/w/Off-hand_gravite_rapier"
            }
          ],
          "note": "",
          "alsoAvailableIn": []
        },
        {
          "tier": "80",
          "style": "Melee",
          "items": [
            {
              "name": "Chaotic Longsword",
              "url": "https://runescape.wiki/w/Chaotic_longsword"
            },
            {
              "name": "Off-hand Chaotic Longsword",
              "url": "https://runescape.wiki/w/Off-hand_chaotic_longsword"
            },
            {
              "name": "Chaotic Maul",
              "url": "https://runescape.wiki/w/Chaotic_maul"
            },
            {
              "name": "Chaotic Spear",
              "url": "https://runescape.wiki/w/Chaotic_spear"
            },
            {
              "name": "Chaotic Rapier",
              "url": "https://runescape.wiki/w/Chaotic_rapier"
            },
            {
              "name": "Off-hand Chaotic Rapier",
              "url": "https://runescape.wiki/w/Off-hand_chaotic_rapier"
            },
            {
              "name": "Chaotic Claw",
              "url": "https://runescape.wiki/w/Chaotic_claw"
            },
            {
              "name": "Off-hand Chaotic Claw",
              "url": "https://runescape.wiki/w/Off-hand_chaotic_claw"
            }
          ],
          "note": "",
          "alsoAvailableIn": []
        },
        {
          "tier": "90",
          "style": "Melee",
          "items": [
            {
              "name": "Ruinous Maul",
              "url": "https://runescape.wiki/w/Ruinous_maul"
            },
            {
              "name": "Ruinous Rapier",
              "url": "https://runescape.wiki/w/Ruinous_rapier"
            },
            {
              "name": "Off-hand Ruinous Rapier",
              "url": "https://runescape.wiki/w/Off-hand_ruinous_rapier"
            }
          ],
          "note": "",
          "alsoAvailableIn": []
        },
        {
          "tier": "55",
          "style": "Magic",
          "items": [
            {
              "name": "Gravite Wand",
              "url": "https://runescape.wiki/w/Gravite_wand"
            },
            {
              "name": "Gravite Orb",
              "url": "https://runescape.wiki/w/Gravite_orb"
            },
            {
              "name": "Gravite Staff",
              "url": "https://runescape.wiki/w/Gravite_staff"
            }
          ],
          "note": "",
          "alsoAvailableIn": []
        },
        {
          "tier": "80",
          "style": "Magic",
          "items": [
            {
              "name": "Chaotic Staff",
              "url": "https://runescape.wiki/w/Chaotic_staff"
            }
          ],
          "note": "",
          "alsoAvailableIn": []
        },
        {
          "tier": "90",
          "style": "Magic",
          "items": [
            {
              "name": "Ruinous Staff",
              "url": "https://runescape.wiki/w/Ruinous_staff"
            }
          ],
          "note": "",
          "alsoAvailableIn": []
        },
        {
          "tier": "55",
          "style": "Ranged",
          "items": [
            {
              "name": "Gravite Chargebow",
              "url": "https://runescape.wiki/w/Gravite_chargebow"
            },
            {
              "name": "Gravite Knife",
              "url": "https://runescape.wiki/w/Gravite_knife"
            },
            {
              "name": "Off-hand Gravite Knife",
              "url": "https://runescape.wiki/w/Off-hand_gravite_knife"
            }
          ],
          "note": "",
          "alsoAvailableIn": []
        },
        {
          "tier": "80",
          "style": "Ranged",
          "items": [
            {
              "name": "Chaotic Crossbow",
              "url": "https://runescape.wiki/w/Chaotic_crossbow"
            },
            {
              "name": "Off-hand Chaotic Crossbow",
              "url": "https://runescape.wiki/w/Off-hand_chaotic_crossbow"
            }
          ],
          "note": "",
          "alsoAvailableIn": []
        },
        {
          "tier": "90",
          "style": "Ranged",
          "items": [
            {
              "name": "Ruinous Crossbow",
              "url": "https://runescape.wiki/w/Ruinous_crossbow"
            },
            {
              "name": "Off-hand Ruinous Crossbow",